{
  "address": "0x59414b3089ce2AF0010e7523Dea7E2b35d776ec7",
  "abi": [
    {
      "inputs": [
        {
          "internalType": "address",
          "name": "_recipient",
          "type": "address"
        }
      ],
      "stateMutability": "nonpayable",
      "type": "constructor"
    },
    {
      "anonymous": false,
      "inputs": [
        {
          "indexed": true,
          "internalType": "address",
          "name": "owner",
          "type": "address"
        },
        {
          "indexed": true,
          "internalType": "address",
          "name": "spender",
          "type": "address"
        },
        {
          "indexed": false,
          "internalType": "uint256",
          "name": "value",
          "type": "uint256"
        }
      ],
      "name": "Approval",
      "type": "event"
    },
    {
      "anonymous": false,
      "inputs": [
        {
          "indexed": true,
          "internalType": "address",
          "name": "from",
          "type": "address"
        },
        {
          "indexed": true,
          "internalType": "address",
          "name": "to",
          "type": "address"
        },
        {
          "indexed": false,
          "internalType": "uint256",
          "name": "value",
          "type": "uint256"
        }
      ],
      "name": "Transfer",
      "type": "event"
    },
    {
      "inputs": [],
      "name": "DOMAIN_TYPEHASH",
      "outputs": [
        {
          "internalType": "bytes32",
          "name": "",
          "type": "bytes32"
        }
      ],
      "stateMutability": "view",
      "type": "function"
    },
    {
      "inputs": [],
      "name": "PERMIT_TYPEHASH",
      "outputs": [
        {
          "internalType": "bytes32",
          "name": "",
          "type": "bytes32"
        }
      ],
      "stateMutability": "view",
      "type": "function"
    },
    {
      "inputs": [],
      "name": "VERSION_HASH",
      "outputs": [
        {
          "internalType": "bytes32",
          "name": "",
          "type": "bytes32"
        }
      ],
      "stateMutability": "view",
      "type": "function"
    },
    {
      "inputs": [
        {
          "internalType": "address",
          "name": "account",
          "type": "address"
        },
        {
          "internalType": "address",
          "name": "spender",
          "type": "address"
        }
      ],
      "name": "allowance",
      "outputs": [
        {
          "internalType": "uint256",
          "name": "",
          "type": "uint256"
        }
      ],
      "stateMutability": "view",
      "type": "function"
    },
    {
      "inputs": [
        {
          "internalType": "address",
          "name": "spender",
          "type": "address"
        },
        {
          "internalType": "uint256",
          "name": "amount",
          "type": "uint256"
        }
      ],
      "name": "approve",
      "outputs": [
        {
          "internalType": "bool",
          "name": "",
          "type": "bool"
        }
      ],
      "stateMutability": "nonpayable",
      "type": "function"
    },
    {
      "inputs": [
        {
          "internalType": "address",
          "name": "account",
          "type": "address"
        }
      ],
      "name": "balanceOf",
      "outputs": [
        {
          "internalType": "uint256",
          "name": "",
          "type": "uint256"
        }
      ],
      "stateMutability": "view",
      "type": "function"
    },
    {
      "inputs": [],
      "name": "decimals",
      "outputs": [
        {
          "internalType": "uint8",
          "name": "",
          "type": "uint8"
        }
      ],
      "stateMutability": "view",
      "type": "function"
    },
    {
      "inputs": [
        {
          "internalType": "address",
          "name": "spender",
          "type": "address"
        },
        {
          "internalType": "uint256",
          "name": "subtractedValue",
          "type": "uint256"
        }
      ],
      "name": "decreaseAllowance",
      "outputs": [
        {
          "internalType": "bool",
          "name": "",
          "type": "bool"
        }
      ],
      "stateMutability": "nonpayable",
      "type": "function"
    },
    {
      "inputs": [],
      "name": "getDomainSeparator",
      "outputs": [
        {
          "internalType": "bytes32",
          "name": "",
          "type": "bytes32"
        }
      ],
      "stateMutability": "view",
      "type": "function"
    },
    {
      "inputs": [
        {
          "internalType": "address",
          "name": "spender",
          "type": "address"
        },
        {
          "internalType": "uint256",
          "name": "addedValue",
          "type": "uint256"
        }
      ],
      "name": "increaseAllowance",
      "outputs": [
        {
          "internalType": "bool",
          "name": "",
          "type": "bool"
        }
      ],
      "stateMutability": "nonpayable",
      "type": "function"
    },
    {
      "inputs": [],
      "name": "name",
      "outputs": [
        {
          "internalType": "string",
          "name": "",
          "type": "string"
        }
      ],
      "stateMutability": "view",
      "type": "function"
    },
    {
      "inputs": [
        {
          "internalType": "address",
          "name": "",
          "type": "address"
        }
      ],
      "name": "nonces",
      "outputs": [
        {
          "internalType": "uint256",
          "name": "",
          "type": "uint256"
        }
      ],
      "stateMutability": "view",
      "type": "function"
    },
    {
      "inputs": [
        {
          "internalType": "address",
          "name": "owner",
          "type": "address"
        },
        {
          "internalType": "address",
          "name": "spender",
          "type": "address"
        },
        {
          "internalType": "uint256",
          "name": "value",
          "type": "uint256"
        },
        {
          "internalType": "uint256",
          "name": "deadline",
          "type": "uint256"
        },
        {
          "internalType": "uint8",
          "name": "v",
          "type": "uint8"
        },
        {
          "internalType": "bytes32",
          "name": "r",
          "type": "bytes32"
        },
        {
          "internalType": "bytes32",
          "name": "s",
          "type": "bytes32"
        }
      ],
      "name": "permit",
      "outputs": [],
      "stateMutability": "nonpayable",
      "type": "function"
    },
    {
      "inputs": [],
      "name": "symbol",
      "outputs": [
        {
          "internalType": "string",
          "name": "",
          "type": "string"
        }
      ],
      "stateMutability": "view",
      "type": "function"
    },
    {
      "inputs": [],
      "name": "totalSupply",
      "outputs": [
        {
          "internalType": "uint256",
          "name": "",
          "type": "uint256"
        }
      ],
      "stateMutability": "view",
      "type": "function"
    },
    {
      "inputs": [
        {
          "internalType": "address",
          "name": "dst",
          "type": "address"
        },
        {
          "internalType": "uint256",
          "name": "amount",
          "type": "uint256"
        }
      ],
      "name": "transfer",
      "outputs": [
        {
          "internalType": "bool",
          "name": "",
          "type": "bool"
        }
      ],
      "stateMutability": "nonpayable",
      "type": "function"
    },
    {
      "inputs": [
        {
          "internalType": "address",
          "name": "src",
          "type": "address"
        },
        {
          "internalType": "address",
          "name": "dst",
          "type": "address"
        },
        {
          "internalType": "uint256",
          "name": "amount",
          "type": "uint256"
        }
      ],
      "name": "transferFrom",
      "outputs": [
        {
          "internalType": "bool",
          "name": "",
          "type": "bool"
        }
      ],
      "stateMutability": "nonpayable",
      "type": "function"
    }
  ],
  "transactionHash": "0x073537478eea01004f6c58fe599a7c482956018312840797253996f6f95ecf67",
  "receipt": {
    "to": null,
    "from": "0x73cBdb19FDF1EDE17C3b77661a2F230c0D3AF5a0",
    "contractAddress": "0x59414b3089ce2AF0010e7523Dea7E2b35d776ec7",
    "transactionIndex": 0,
    "gasUsed": "1132790",
    "logsBloom": "0x00000000000000000000000000000000000000000000000000000000000000008000000000000000000000000000000000000000000000000000000000000000000000000000000000000008000000000000000020000000000000000000000000000000020000000000000000000800000000000000000000000010000004000000000000000000000000000000000000040008000000000000000000000000000000000000000000000000000000000000000000000000000000000000080000000002000000000000000000000000000000000000000000000000000020000000000000000000000000000000000000000000000000000000000000000000",
    "blockHash": "0x8b5911164e8163fc0acc56b426cc1206610643c67e2c1154bc970628bcbf5cf6",
    "transactionHash": "0x073537478eea01004f6c58fe599a7c482956018312840797253996f6f95ecf67",
    "logs": [
      {
        "transactionIndex": 0,
        "blockNumber": 2920530,
        "transactionHash": "0x073537478eea01004f6c58fe599a7c482956018312840797253996f6f95ecf67",
        "address": "0x59414b3089ce2AF0010e7523Dea7E2b35d776ec7",
        "topics": [
          "0xddf252ad1be2c89b69c2b068fc378daa952ba7f163c4a11628f55a4df523b3ef",
          "0x0000000000000000000000000000000000000000000000000000000000000000",
          "0x000000000000000000000000dcedf06fd33e1d7b6eb4b309f779a0e9d3172e44"
        ],
        "data": "0x00000000000000000000000000000000000000000000021e19e0c9bab2400000",
        "logIndex": 0,
        "blockHash": "0x8b5911164e8163fc0acc56b426cc1206610643c67e2c1154bc970628bcbf5cf6"
      }
    ],
    "blockNumber": 2920530,
    "cumulativeGasUsed": "1132790",
    "status": 1,
    "byzantium": true
  },
  "args": [
    "0xDcEDF06Fd33E1D7b6eb4b309f779a0e9D3172e44"
  ],
  "solcInputHash": "cbca27c4fdf8e9078ea5771556254fe0",
  "metadata": "{\"compiler\":{\"version\":\"0.7.3+commit.9bfce1f6\"},\"language\":\"Solidity\",\"output\":{\"abi\":[{\"inputs\":[{\"internalType\":\"address\",\"name\":\"_recipient\",\"type\":\"address\"}],\"stateMutability\":\"nonpayable\",\"type\":\"constructor\"},{\"anonymous\":false,\"inputs\":[{\"indexed\":true,\"internalType\":\"address\",\"name\":\"owner\",\"type\":\"address\"},{\"indexed\":true,\"internalType\":\"address\",\"name\":\"spender\",\"type\":\"address\"},{\"indexed\":false,\"internalType\":\"uint256\",\"name\":\"value\",\"type\":\"uint256\"}],\"name\":\"Approval\",\"type\":\"event\"},{\"anonymous\":false,\"inputs\":[{\"indexed\":true,\"internalType\":\"address\",\"name\":\"from\",\"type\":\"address\"},{\"indexed\":true,\"internalType\":\"address\",\"name\":\"to\",\"type\":\"address\"},{\"indexed\":false,\"internalType\":\"uint256\",\"name\":\"value\",\"type\":\"uint256\"}],\"name\":\"Transfer\",\"type\":\"event\"},{\"inputs\":[],\"name\":\"DOMAIN_TYPEHASH\",\"outputs\":[{\"internalType\":\"bytes32\",\"name\":\"\",\"type\":\"bytes32\"}],\"stateMutability\":\"view\",\"type\":\"function\"},{\"inputs\":[],\"name\":\"PERMIT_TYPEHASH\",\"outputs\":[{\"internalType\":\"bytes32\",\"name\":\"\",\"type\":\"bytes32\"}],\"stateMutability\":\"view\",\"type\":\"function\"},{\"inputs\":[],\"name\":\"VERSION_HASH\",\"outputs\":[{\"internalType\":\"bytes32\",\"name\":\"\",\"type\":\"bytes32\"}],\"stateMutability\":\"view\",\"type\":\"function\"},{\"inputs\":[{\"internalType\":\"address\",\"name\":\"account\",\"type\":\"address\"},{\"internalType\":\"address\",\"name\":\"spender\",\"type\":\"address\"}],\"name\":\"allowance\",\"outputs\":[{\"internalType\":\"uint256\",\"name\":\"\",\"type\":\"uint256\"}],\"stateMutability\":\"view\",\"type\":\"function\"},{\"inputs\":[{\"internalType\":\"address\",\"name\":\"spender\",\"type\":\"address\"},{\"internalType\":\"uint256\",\"name\":\"amount\",\"type\":\"uint256\"}],\"name\":\"approve\",\"outputs\":[{\"internalType\":\"bool\",\"name\":\"\",\"type\":\"bool\"}],\"stateMutability\":\"nonpayable\",\"type\":\"function\"},{\"inputs\":[{\"internalType\":\"address\",\"name\":\"account\",\"type\":\"address\"}],\"name\":\"balanceOf\",\"outputs\":[{\"internalType\":\"uint256\",\"name\":\"\",\"type\":\"uint256\"}],\"stateMutability\":\"view\",\"type\":\"function\"},{\"inputs\":[],\"name\":\"decimals\",\"outputs\":[{\"internalType\":\"uint8\",\"name\":\"\",\"type\":\"uint8\"}],\"stateMutability\":\"view\",\"type\":\"function\"},{\"inputs\":[{\"internalType\":\"address\",\"name\":\"spender\",\"type\":\"address\"},{\"internalType\":\"uint256\",\"name\":\"subtractedValue\",\"type\":\"uint256\"}],\"name\":\"decreaseAllowance\",\"outputs\":[{\"internalType\":\"bool\",\"name\":\"\",\"type\":\"bool\"}],\"stateMutability\":\"nonpayable\",\"type\":\"function\"},{\"inputs\":[],\"name\":\"getDomainSeparator\",\"outputs\":[{\"internalType\":\"bytes32\",\"name\":\"\",\"type\":\"bytes32\"}],\"stateMutability\":\"view\",\"type\":\"function\"},{\"inputs\":[{\"internalType\":\"address\",\"name\":\"spender\",\"type\":\"address\"},{\"internalType\":\"uint256\",\"name\":\"addedValue\",\"type\":\"uint256\"}],\"name\":\"increaseAllowance\",\"outputs\":[{\"internalType\":\"bool\",\"name\":\"\",\"type\":\"bool\"}],\"stateMutability\":\"nonpayable\",\"type\":\"function\"},{\"inputs\":[],\"name\":\"name\",\"outputs\":[{\"internalType\":\"string\",\"name\":\"\",\"type\":\"string\"}],\"stateMutability\":\"view\",\"type\":\"function\"},{\"inputs\":[{\"internalType\":\"address\",\"name\":\"\",\"type\":\"address\"}],\"name\":\"nonces\",\"outputs\":[{\"internalType\":\"uint256\",\"name\":\"\",\"type\":\"uint256\"}],\"stateMutability\":\"view\",\"type\":\"function\"},{\"inputs\":[{\"internalType\":\"address\",\"name\":\"owner\",\"type\":\"address\"},{\"internalType\":\"address\",\"name\":\"spender\",\"type\":\"address\"},{\"internalType\":\"uint256\",\"name\":\"value\",\"type\":\"uint256\"},{\"internalType\":\"uint256\",\"name\":\"deadline\",\"type\":\"uint256\"},{\"internalType\":\"uint8\",\"name\":\"v\",\"type\":\"uint8\"},{\"internalType\":\"bytes32\",\"name\":\"r\",\"type\":\"bytes32\"},{\"internalType\":\"bytes32\",\"name\":\"s\",\"type\":\"bytes32\"}],\"name\":\"permit\",\"outputs\":[],\"stateMutability\":\"nonpayable\",\"type\":\"function\"},{\"inputs\":[],\"name\":\"symbol\",\"outputs\":[{\"internalType\":\"string\",\"name\":\"\",\"type\":\"string\"}],\"stateMutability\":\"view\",\"type\":\"function\"},{\"inputs\":[],\"name\":\"totalSupply\",\"outputs\":[{\"internalType\":\"uint256\",\"name\":\"\",\"type\":\"uint256\"}],\"stateMutability\":\"view\",\"type\":\"function\"},{\"inputs\":[{\"internalType\":\"address\",\"name\":\"dst\",\"type\":\"address\"},{\"internalType\":\"uint256\",\"name\":\"amount\",\"type\":\"uint256\"}],\"name\":\"transfer\",\"outputs\":[{\"internalType\":\"bool\",\"name\":\"\",\"type\":\"bool\"}],\"stateMutability\":\"nonpayable\",\"type\":\"function\"},{\"inputs\":[{\"internalType\":\"address\",\"name\":\"src\",\"type\":\"address\"},{\"internalType\":\"address\",\"name\":\"dst\",\"type\":\"address\"},{\"internalType\":\"uint256\",\"name\":\"amount\",\"type\":\"uint256\"}],\"name\":\"transferFrom\",\"outputs\":[{\"internalType\":\"bool\",\"name\":\"\",\"type\":\"bool\"}],\"stateMutability\":\"nonpayable\",\"type\":\"function\"}],\"devdoc\":{\"details\":\"The governance token for Yield Yak ERC-20 with fixed supply + offchain signing\",\"kind\":\"dev\",\"methods\":{\"allowance(address,address)\":{\"params\":{\"account\":\"The address of the account holding the funds\",\"spender\":\"The address of the account spending the funds\"},\"returns\":{\"_0\":\"The number of tokens approved\"}},\"approve(address,uint256)\":{\"details\":\"This will overwrite the approval amount for `spender` and is subject to issues noted [here](https://eips.ethereum.org/EIPS/eip-20#approve) It is recommended to use increaseAllowance and decreaseAllowance instead\",\"params\":{\"amount\":\"The number of tokens that are approved (2^256-1 means infinite)\",\"spender\":\"The address of the account which may transfer tokens\"},\"returns\":{\"_0\":\"Whether or not the approval succeeded\"}},\"balanceOf(address)\":{\"params\":{\"account\":\"The address of the account to get the balance of\"},\"returns\":{\"_0\":\"The number of tokens held\"}},\"decreaseAllowance(address,uint256)\":{\"params\":{\"spender\":\"Spender's address\",\"subtractedValue\":\"Amount of decrease in allowance\"},\"returns\":{\"_0\":\"True if successful\"}},\"getDomainSeparator()\":{\"returns\":{\"_0\":\"Separator\"}},\"increaseAllowance(address,uint256)\":{\"params\":{\"addedValue\":\"Amount of increase in allowance\",\"spender\":\"Spender's address\"},\"returns\":{\"_0\":\"True if successful\"}},\"permit(address,address,uint256,uint256,uint8,bytes32,bytes32)\":{\"params\":{\"deadline\":\"The time at which to expire the signature\",\"owner\":\"The address to approve from\",\"r\":\"Half of the ECDSA signature pair\",\"s\":\"Half of the ECDSA signature pair\",\"spender\":\"The address to be approved\",\"v\":\"The recovery byte of the signature\",\"value\":\"The number of tokens that are approved (2^256-1 means infinite)\"}},\"transfer(address,uint256)\":{\"params\":{\"amount\":\"The number of tokens to transfer\",\"dst\":\"The address of the destination account\"},\"returns\":{\"_0\":\"Whether or not the transfer succeeded\"}},\"transferFrom(address,address,uint256)\":{\"params\":{\"amount\":\"The number of tokens to transfer\",\"dst\":\"The address of the destination account\",\"src\":\"The address of the source account\"},\"returns\":{\"_0\":\"Whether or not the transfer succeeded\"}}},\"stateVariables\":{\"allowances\":{\"details\":\"Allowance amounts on behalf of others\"},\"balances\":{\"details\":\"Official record of token balances for each account\"}},\"title\":\"YakToken\",\"version\":1},\"userdoc\":{\"events\":{\"Approval(address,address,uint256)\":{\"notice\":\"The standard EIP-20 approval event\"},\"Transfer(address,address,uint256)\":{\"notice\":\"The standard EIP-20 transfer event\"}},\"kind\":\"user\",\"methods\":{\"DOMAIN_TYPEHASH()\":{\"notice\":\"The EIP-712 typehash for the contract's domain, keccak256(\\\"EIP712Domain(string name,string version,uint256 chainId,address verifyingContract)\\\")\"},\"PERMIT_TYPEHASH()\":{\"notice\":\"The EIP-712 typehash for permit (EIP-2612), keccak256(\\\"Permit(address owner,address spender,uint256 value,uint256 nonce,uint256 deadline)\\\");\"},\"VERSION_HASH()\":{\"notice\":\"The EIP-712 version hash, keccak256(\\\"1\\\");\"},\"allowance(address,address)\":{\"notice\":\"Get the number of tokens `spender` is approved to spend on behalf of `account`\"},\"approve(address,uint256)\":{\"notice\":\"Approve `spender` to transfer up to `amount` from `src`\"},\"balanceOf(address)\":{\"notice\":\"Get the number of tokens held by the `account`\"},\"constructor\":{\"notice\":\"Create and send entire token supply to _recipient\"},\"decimals()\":{\"notice\":\"EIP-20 token decimals for this token\"},\"decreaseAllowance(address,uint256)\":{\"notice\":\"Decrease the allowance by a given amount\"},\"getDomainSeparator()\":{\"notice\":\"EIP-712 Domain separator\"},\"increaseAllowance(address,uint256)\":{\"notice\":\"Increase the allowance by a given amount\"},\"name()\":{\"notice\":\"EIP-20 token name for this token\"},\"nonces(address)\":{\"notice\":\"A record of states for signing / validating signatures\"},\"permit(address,address,uint256,uint256,uint8,bytes32,bytes32)\":{\"notice\":\"Triggers an approval from owner to spender\"},\"symbol()\":{\"notice\":\"EIP-20 token symbol for this token\"},\"totalSupply()\":{\"notice\":\"Total number of tokens in circulation\"},\"transfer(address,uint256)\":{\"notice\":\"Transfer `amount` tokens from `msg.sender` to `dst`\"},\"transferFrom(address,address,uint256)\":{\"notice\":\"Transfer `amount` tokens from `src` to `dst`\"}},\"version\":1}},\"settings\":{\"compilationTarget\":{\"contracts/YakToken.sol\":\"YakToken\"},\"evmVersion\":\"istanbul\",\"libraries\":{},\"metadata\":{\"bytecodeHash\":\"ipfs\",\"useLiteralContent\":true},\"optimizer\":{\"enabled\":true,\"runs\":9999},\"remappings\":[]},\"sources\":{\"contracts/YakToken.sol\":{\"content\":\"// SPDX-License-Identifier: MIT\\npragma solidity ^0.7.0;\\npragma experimental ABIEncoderV2;\\n\\nimport \\\"./lib/SafeMath.sol\\\";\\n\\n/**\\n * @title YakToken\\n * @dev The governance token for Yield Yak\\n * ERC-20 with fixed supply + offchain signing\\n */\\ncontract YakToken {\\n    using SafeMath for uint256;\\n\\n    /// @notice EIP-20 token name for this token\\n    string public name = \\\"Yak Token\\\";\\n\\n    /// @notice EIP-20 token symbol for this token\\n    string public symbol = \\\"YAK\\\";\\n\\n    /// @notice EIP-20 token decimals for this token\\n    uint8 public constant decimals = 18;\\n\\n    /// @notice Total number of tokens in circulation\\n    uint256 public totalSupply = 10_000e18; // 10,000\\n\\n    /// @dev Allowance amounts on behalf of others\\n    mapping (address => mapping (address => uint256)) internal allowances;\\n\\n    /// @dev Official record of token balances for each account\\n    mapping (address => uint256) internal balances;\\n\\n    /// @notice The EIP-712 typehash for the contract's domain, keccak256(\\\"EIP712Domain(string name,string version,uint256 chainId,address verifyingContract)\\\")\\n    bytes32 public constant DOMAIN_TYPEHASH = 0x8b73c3c69bb8fe3d512ecc4cf759cc79239f7b179b0ffacaa9a75d522b39400f;\\n    \\n    /// @notice The EIP-712 version hash, keccak256(\\\"1\\\");\\n    bytes32 public constant VERSION_HASH = 0xc89efdaa54c0f20c7adf612882df0950f5a951637e0307cdcb4c672f298b8bc6;\\n\\n    /// @notice The EIP-712 typehash for permit (EIP-2612), keccak256(\\\"Permit(address owner,address spender,uint256 value,uint256 nonce,uint256 deadline)\\\");\\n    bytes32 public constant PERMIT_TYPEHASH = 0x6e71edae12b1b97f4d1f60370fef10105fa2faae0126114a169c64845d6126c9;\\n\\n    /// @notice A record of states for signing / validating signatures\\n    mapping (address => uint) public nonces;\\n\\n    /// @notice The standard EIP-20 transfer event\\n    event Transfer(address indexed from, address indexed to, uint256 value);\\n\\n    /// @notice The standard EIP-20 approval event\\n    event Approval(address indexed owner, address indexed spender, uint256 value);\\n\\n    /**\\n     * @notice Create and send entire token supply to _recipient\\n     */\\n    constructor(address _recipient) {\\n        balances[_recipient] = totalSupply;\\n        emit Transfer(address(0), _recipient, totalSupply);\\n    }\\n\\n    /**\\n     * @notice Get the number of tokens `spender` is approved to spend on behalf of `account`\\n     * @param account The address of the account holding the funds\\n     * @param spender The address of the account spending the funds\\n     * @return The number of tokens approved\\n     */\\n    function allowance(address account, address spender) external view returns (uint) {\\n        return allowances[account][spender];\\n    }\\n\\n    /**\\n     * @notice Approve `spender` to transfer up to `amount` from `src`\\n     * @dev This will overwrite the approval amount for `spender`\\n     * and is subject to issues noted [here](https://eips.ethereum.org/EIPS/eip-20#approve)\\n     * It is recommended to use increaseAllowance and decreaseAllowance instead\\n     * @param spender The address of the account which may transfer tokens\\n     * @param amount The number of tokens that are approved (2^256-1 means infinite)\\n     * @return Whether or not the approval succeeded\\n     */\\n    function approve(address spender, uint256 amount) external returns (bool) {\\n        _approve(msg.sender, spender, amount);\\n        return true;\\n    }\\n\\n    /**\\n     * @notice Increase the allowance by a given amount\\n     * @param spender Spender's address\\n     * @param addedValue Amount of increase in allowance\\n     * @return True if successful\\n     */\\n    function increaseAllowance(address spender, uint256 addedValue)\\n        external\\n        returns (bool)\\n    {\\n        _increaseAllowance(msg.sender, spender, addedValue);\\n        return true;\\n    }\\n\\n    /**\\n     * @notice Decrease the allowance by a given amount\\n     * @param spender Spender's address\\n     * @param subtractedValue Amount of decrease in allowance\\n     * @return True if successful\\n     */\\n    function decreaseAllowance(address spender, uint256 subtractedValue)\\n        external\\n        returns (bool)\\n    {\\n        _decreaseAllowance(msg.sender, spender, subtractedValue);\\n        return true;\\n    }\\n\\n    /**\\n     * @notice Triggers an approval from owner to spender\\n     * @param owner The address to approve from\\n     * @param spender The address to be approved\\n     * @param value The number of tokens that are approved (2^256-1 means infinite)\\n     * @param deadline The time at which to expire the signature\\n     * @param v The recovery byte of the signature\\n     * @param r Half of the ECDSA signature pair\\n     * @param s Half of the ECDSA signature pair\\n     */\\n    function permit(address owner, address spender, uint256 value, uint256 deadline, uint8 v, bytes32 r, bytes32 s) external {\\n        require(deadline >= block.timestamp, \\\"Yak::permit: signature expired\\\");\\n\\n        bytes32 encodeData = keccak256(abi.encode(PERMIT_TYPEHASH, owner, spender, value, nonces[owner]++, deadline));\\n        _validateSignedData(owner, encodeData, v, r, s);\\n\\n        _approve(owner, spender, value);\\n    }\\n\\n    /**\\n     * @notice Get the number of tokens held by the `account`\\n     * @param account The address of the account to get the balance of\\n     * @return The number of tokens held\\n     */\\n    function balanceOf(address account) external view returns (uint) {\\n        return balances[account];\\n    }\\n\\n    /**\\n     * @notice Transfer `amount` tokens from `msg.sender` to `dst`\\n     * @param dst The address of the destination account\\n     * @param amount The number of tokens to transfer\\n     * @return Whether or not the transfer succeeded\\n     */\\n    function transfer(address dst, uint256 amount) external returns (bool) {\\n        _transferTokens(msg.sender, dst, amount);\\n        return true;\\n    }\\n\\n    /**\\n     * @notice Transfer `amount` tokens from `src` to `dst`\\n     * @param src The address of the source account\\n     * @param dst The address of the destination account\\n     * @param amount The number of tokens to transfer\\n     * @return Whether or not the transfer succeeded\\n     */\\n    function transferFrom(address src, address dst, uint256 amount) external returns (bool) {\\n        address spender = msg.sender;\\n        uint256 spenderAllowance = allowances[src][spender];\\n\\n        if (spender != src && spenderAllowance != uint256(-1)) {\\n            uint256 newAllowance = spenderAllowance.sub(\\n                amount,\\n                \\\"Yak::transferFrom: transfer amount exceeds allowance\\\"\\n            );\\n            allowances[src][spender] = newAllowance;\\n\\n            emit Approval(src, spender, newAllowance);\\n        }\\n\\n        _transferTokens(src, dst, amount);\\n        return true;\\n    }\\n\\n    /**\\n     * @notice EIP-712 Domain separator\\n     * @return Separator\\n     */\\n    function getDomainSeparator() public view returns (bytes32) {\\n        return keccak256(\\n            abi.encode(\\n                DOMAIN_TYPEHASH,\\n                keccak256(bytes(name)),\\n                VERSION_HASH,\\n                _getChainId(),\\n                address(this)\\n            )\\n        );\\n    }\\n\\n    /**\\n     * @notice Recovers address from signed data and validates the signature\\n     * @param signer Address that signed the data\\n     * @param encodeData Data signed by the address\\n     * @param v The recovery byte of the signature\\n     * @param r Half of the ECDSA signature pair\\n     * @param s Half of the ECDSA signature pair\\n     */\\n    function _validateSignedData(address signer, bytes32 encodeData, uint8 v, bytes32 r, bytes32 s) internal view {\\n        bytes32 digest = keccak256(\\n            abi.encodePacked(\\n                \\\"\\\\x19\\\\x01\\\",\\n                getDomainSeparator(),\\n                encodeData\\n            )\\n        );\\n        address recoveredAddress = ecrecover(digest, v, r, s);\\n        // Explicitly disallow authorizations for address(0) as ecrecover returns address(0) on malformed messages\\n        require(recoveredAddress != address(0) && recoveredAddress == signer, \\\"Yak::validateSig: invalid signature\\\");\\n    }\\n\\n    /**\\n     * @notice Approval implementation\\n     * @param owner The address of the account which owns tokens\\n     * @param spender The address of the account which may transfer tokens\\n     * @param amount The number of tokens that are approved (2^256-1 means infinite)\\n     */\\n    function _approve(address owner, address spender, uint256 amount) internal {\\n        require(owner != address(0), \\\"Yak::_approve: approve from the zero address\\\");\\n        require(spender != address(0), \\\"Yak::_approve: approve to the zero address\\\");\\n        allowances[owner][spender] = amount;\\n        emit Approval(owner, spender, amount);\\n    }\\n\\n    function _increaseAllowance(\\n        address owner,\\n        address spender,\\n        uint256 addedValue\\n    ) internal {\\n        _approve(owner, spender, allowances[owner][spender].add(addedValue));\\n    }\\n\\n    function _decreaseAllowance(\\n        address owner,\\n        address spender,\\n        uint256 subtractedValue\\n    ) internal {\\n        _approve(\\n            owner,\\n            spender,\\n            allowances[owner][spender].sub(\\n                subtractedValue,\\n                \\\"Yak::_decreaseAllowance: decreased allowance below zero\\\"\\n            )\\n        );\\n    }\\n\\n    /**\\n     * @notice Transfer implementation\\n     * @param from The address of the account which owns tokens\\n     * @param to The address of the account which is receiving tokens\\n     * @param value The number of tokens that are being transferred\\n     */\\n    function _transferTokens(address from, address to, uint256 value) internal {\\n        require(to != address(0), \\\"Yak::_transferTokens: cannot transfer to the zero address\\\");\\n\\n        balances[from] = balances[from].sub(\\n            value,\\n            \\\"Yak::_transferTokens: transfer exceeds from balance\\\"\\n        );\\n        balances[to] = balances[to].add(value);\\n        emit Transfer(from, to, value);\\n    }\\n\\n    /**\\n     * @notice Current id of the chain where this contract is deployed\\n     * @return Chain id\\n     */\\n    function _getChainId() internal pure returns (uint) {\\n        uint256 chainId;\\n        assembly { chainId := chainid() }\\n        return chainId;\\n    }\\n}\",\"keccak256\":\"0x6e14081dbd1203e0b3a295609105227c3991932afadfde5a24d3b20f6a3bb1d5\",\"license\":\"MIT\"},\"contracts/lib/SafeMath.sol\":{\"content\":\"// SPDX-License-Identifier: MIT\\npragma solidity ^0.7.0;\\n\\n// From https://github.com/OpenZeppelin/openzeppelin-contracts/blob/master/contracts/math/Math.sol\\n// Subject to the MIT license.\\n\\n/**\\n * @dev Wrappers over Solidity's arithmetic operations with added overflow\\n * checks.\\n *\\n * Arithmetic operations in Solidity wrap on overflow. This can easily result\\n * in bugs, because programmers usually assume that an overflow raises an\\n * error, which is the standard behavior in high level programming languages.\\n * `SafeMath` restores this intuition by reverting the transaction when an\\n * operation overflows.\\n *\\n * Using this library instead of the unchecked operations eliminates an entire\\n * class of bugs, so it's recommended to use it always.\\n */\\nlibrary SafeMath {\\n    /**\\n     * @dev Returns the addition of two unsigned integers, reverting on overflow.\\n     *\\n     * Counterpart to Solidity's `+` operator.\\n     *\\n     * Requirements:\\n     * - Addition cannot overflow.\\n     */\\n    function add(uint256 a, uint256 b) internal pure returns (uint256) {\\n        uint256 c = a + b;\\n        require(c >= a, \\\"SafeMath: addition overflow\\\");\\n\\n        return c;\\n    }\\n\\n    /**\\n     * @dev Returns the addition of two unsigned integers, reverting with custom message on overflow.\\n     *\\n     * Counterpart to Solidity's `+` operator.\\n     *\\n     * Requirements:\\n     * - Addition cannot overflow.\\n     */\\n    function add(uint256 a, uint256 b, string memory errorMessage) internal pure returns (uint256) {\\n        uint256 c = a + b;\\n        require(c >= a, errorMessage);\\n\\n        return c;\\n    }\\n\\n    /**\\n     * @dev Returns the subtraction of two unsigned integers, reverting on underflow (when the result is negative).\\n     *\\n     * Counterpart to Solidity's `-` operator.\\n     *\\n     * Requirements:\\n     * - Subtraction cannot underflow.\\n     */\\n    function sub(uint256 a, uint256 b) internal pure returns (uint256) {\\n        return sub(a, b, \\\"SafeMath: subtraction underflow\\\");\\n    }\\n\\n    /**\\n     * @dev Returns the subtraction of two unsigned integers, reverting with custom message on underflow (when the result is negative).\\n     *\\n     * Counterpart to Solidity's `-` operator.\\n     *\\n     * Requirements:\\n     * - Subtraction cannot underflow.\\n     */\\n    function sub(uint256 a, uint256 b, string memory errorMessage) internal pure returns (uint256) {\\n        require(b <= a, errorMessage);\\n        uint256 c = a - b;\\n\\n        return c;\\n    }\\n\\n    /**\\n     * @dev Returns the multiplication of two unsigned integers, reverting on overflow.\\n     *\\n     * Counterpart to Solidity's `*` operator.\\n     *\\n     * Requirements:\\n     * - Multiplication cannot overflow.\\n     */\\n    function mul(uint256 a, uint256 b) internal pure returns (uint256) {\\n        // Gas optimization: this is cheaper than requiring 'a' not being zero, but the\\n        // benefit is lost if 'b' is also tested.\\n        // See: https://github.com/OpenZeppelin/openzeppelin-contracts/pull/522\\n        if (a == 0) {\\n            return 0;\\n        }\\n\\n        uint256 c = a * b;\\n        require(c / a == b, \\\"SafeMath: multiplication overflow\\\");\\n\\n        return c;\\n    }\\n\\n    /**\\n     * @dev Returns the multiplication of two unsigned integers, reverting on overflow.\\n     *\\n     * Counterpart to Solidity's `*` operator.\\n     *\\n     * Requirements:\\n     * - Multiplication cannot overflow.\\n     */\\n    function mul(uint256 a, uint256 b, string memory errorMessage) internal pure returns (uint256) {\\n        // Gas optimization: this is cheaper than requiring 'a' not being zero, but the\\n        // benefit is lost if 'b' is also tested.\\n        // See: https://github.com/OpenZeppelin/openzeppelin-contracts/pull/522\\n        if (a == 0) {\\n            return 0;\\n        }\\n\\n        uint256 c = a * b;\\n        require(c / a == b, errorMessage);\\n\\n        return c;\\n    }\\n\\n    /**\\n     * @dev Returns the integer division of two unsigned integers.\\n     * Reverts on division by zero. The result is rounded towards zero.\\n     *\\n     * Counterpart to Solidity's `/` operator. Note: this function uses a\\n     * `revert` opcode (which leaves remaining gas untouched) while Solidity\\n     * uses an invalid opcode to revert (consuming all remaining gas).\\n     *\\n     * Requirements:\\n     * - The divisor cannot be zero.\\n     */\\n    function div(uint256 a, uint256 b) internal pure returns (uint256) {\\n        return div(a, b, \\\"SafeMath: division by zero\\\");\\n    }\\n\\n    /**\\n     * @dev Returns the integer division of two unsigned integers.\\n     * Reverts with custom message on division by zero. The result is rounded towards zero.\\n     *\\n     * Counterpart to Solidity's `/` operator. Note: this function uses a\\n     * `revert` opcode (which leaves remaining gas untouched) while Solidity\\n     * uses an invalid opcode to revert (consuming all remaining gas).\\n     *\\n     * Requirements:\\n     * - The divisor cannot be zero.\\n     */\\n    function div(uint256 a, uint256 b, string memory errorMessage) internal pure returns (uint256) {\\n        // Solidity only automatically asserts when dividing by 0\\n        require(b > 0, errorMessage);\\n        uint256 c = a / b;\\n        // assert(a == b * c + a % b); // There is no case in which this doesn't hold\\n\\n        return c;\\n    }\\n\\n    /**\\n     * @dev Returns the remainder of dividing two unsigned integers. (unsigned integer modulo),\\n     * Reverts when dividing by zero.\\n     *\\n     * Counterpart to Solidity's `%` operator. This function uses a `revert`\\n     * opcode (which leaves remaining gas untouched) while Solidity uses an\\n     * invalid opcode to revert (consuming all remaining gas).\\n     *\\n     * Requirements:\\n     * - The divisor cannot be zero.\\n     */\\n    function mod(uint256 a, uint256 b) internal pure returns (uint256) {\\n        return mod(a, b, \\\"SafeMath: modulo by zero\\\");\\n    }\\n\\n    /**\\n     * @dev Returns the remainder of dividing two unsigned integers. (unsigned integer modulo),\\n     * Reverts with custom message when dividing by zero.\\n     *\\n     * Counterpart to Solidity's `%` operator. This function uses a `revert`\\n     * opcode (which leaves remaining gas untouched) while Solidity uses an\\n     * invalid opcode to revert (consuming all remaining gas).\\n     *\\n     * Requirements:\\n     * - The divisor cannot be zero.\\n     */\\n    function mod(uint256 a, uint256 b, string memory errorMessage) internal pure returns (uint256) {\\n        require(b != 0, errorMessage);\\n        return a % b;\\n    }\\n}\",\"keccak256\":\"0x961855901713e710c05dd67f9a01e501a54e82e68a526fe3662e228c27f788d9\",\"license\":\"MIT\"}},\"version\":1}",
  "bytecode": "0x60c060405260096080819052682cb0b5902a37b5b2b760b91b60a09081526200002c9160009190620000f8565b506040805180820190915260038082526259414b60e81b60209092019182526200005991600191620000f8565b5069021e19e0c9bab24000006002553480156200007557600080fd5b50604051620013ab380380620013ab833981016040819052620000989162000194565b6002546001600160a01b03821660008181526004602052604080822084905551919290917fddf252ad1be2c89b69c2b068fc378daa952ba7f163c4a11628f55a4df523b3ef91620000e991620001c4565b60405180910390a350620001cd565b828054600181600116156101000203166002900490600052602060002090601f016020900481019282601f106200013b57805160ff19168380011785556200016b565b828001600101855582156200016b579182015b828111156200016b5782518255916020019190600101906200014e565b50620001799291506200017d565b5090565b5b808211156200017957600081556001016200017e565b600060208284031215620001a6578081fd5b81516001600160a01b0381168114620001bd578182fd5b9392505050565b90815260200190565b6111ce80620001dd6000396000f3fe608060405234801561001057600080fd5b506004361061011b5760003560e01c806370a08231116100b2578063a457c2d711610081578063d505accf11610066578063d505accf1461021a578063dd62ed3e1461022f578063ed24911d146102425761011b565b8063a457c2d7146101f4578063a9059cbb146102075761011b565b806370a08231146101be5780637ecebe00146101d157806395d89b41146101e45780639e4e7318146101ec5761011b565b806323b872dd116100ee57806323b872dd1461017b57806330adf81f1461018e578063313ce5671461019657806339509351146101ab5761011b565b806306fdde0314610120578063095ea7b31461013e57806318160ddd1461015e57806320606b7014610173575b600080fd5b61012861024a565b6040516101359190610e99565b60405180910390f35b61015161014c366004610d00565b6102f6565b6040516101359190610ded565b61016661030c565b6040516101359190610df8565b610166610312565b610151610189366004610c54565b610336565b610166610455565b61019e610479565b60405161013591906110ec565b6101516101b9366004610d00565b61047e565b6101666101cc366004610c08565b61048b565b6101666101df366004610c08565b6104b7565b6101286104c9565b610166610541565b610151610202366004610d00565b610565565b610151610215366004610d00565b610572565b61022d610228366004610c8f565b61057f565b005b61016661023d366004610c22565b610664565b61016661069c565b6000805460408051602060026001851615610100027fffffffffffffffffffffffffffffffffffffffffffffffffffffffffffffffff0190941693909304601f810184900484028201840190925281815292918301828280156102ee5780601f106102c3576101008083540402835291602001916102ee565b820191906000526020600020905b8154815290600101906020018083116102d157829003601f168201915b505050505081565b6000610303338484610733565b50600192915050565b60025481565b7f8b73c3c69bb8fe3d512ecc4cf759cc79239f7b179b0ffacaa9a75d522b39400f81565b73ffffffffffffffffffffffffffffffffffffffff831660008181526003602090815260408083203380855292528220549192909190821480159061039b57507fffffffffffffffffffffffffffffffffffffffffffffffffffffffffffffffff8114155b1561043e5760006103c78560405180606001604052806034815260200161113260349139849190610842565b73ffffffffffffffffffffffffffffffffffffffff808916600081815260036020908152604080832094891680845294909152908190208490555192935090917f8c5be1e5ebec7d5bd14f71427d1e84f3dd0314c0f7b2291e5b200ac8c7c3b92590610434908590610df8565b60405180910390a3505b610449868686610888565b50600195945050505050565b7f6e71edae12b1b97f4d1f60370fef10105fa2faae0126114a169c64845d6126c981565b601281565b60006103033384846109ba565b73ffffffffffffffffffffffffffffffffffffffff81166000908152600460205260409020545b919050565b60056020526000908152604090205481565b60018054604080516020600284861615610100027fffffffffffffffffffffffffffffffffffffffffffffffffffffffffffffffff0190941693909304601f810184900484028201840190925281815292918301828280156102ee5780601f106102c3576101008083540402835291602001916102ee565b7fc89efdaa54c0f20c7adf612882df0950f5a951637e0307cdcb4c672f298b8bc681565b6000610303338484610a09565b6000610303338484610888565b428410156105c2576040517f08c379a00000000000000000000000000000000000000000000000000000000081526004016105b990610ffb565b60405180910390fd5b73ffffffffffffffffffffffffffffffffffffffff87166000908152600560209081526040808320805460018101909155905161062a927f6e71edae12b1b97f4d1f60370fef10105fa2faae0126114a169c64845d6126c9928c928c928c92918c9101610e01565b60405160208183030381529060405280519060200120905061064f8882868686610a65565b61065a888888610733565b5050505050505050565b73ffffffffffffffffffffffffffffffffffffffff918216600090815260036020908152604080832093909416825291909152205490565b60007f8b73c3c69bb8fe3d512ecc4cf759cc79239f7b179b0ffacaa9a75d522b39400f60001b60006040516106d19190610d29565b6040519081900390207fc89efdaa54c0f20c7adf612882df0950f5a951637e0307cdcb4c672f298b8bc6610703610b9a565b30604051602001610718959493929190610e42565b60405160208183030381529060405280519060200120905090565b73ffffffffffffffffffffffffffffffffffffffff8316610780576040517f08c379a00000000000000000000000000000000000000000000000000000000081526004016105b990610f41565b73ffffffffffffffffffffffffffffffffffffffff82166107cd576040517f08c379a00000000000000000000000000000000000000000000000000000000081526004016105b990611032565b73ffffffffffffffffffffffffffffffffffffffff80841660008181526003602090815260408083209487168084529490915290819020849055517f8c5be1e5ebec7d5bd14f71427d1e84f3dd0314c0f7b2291e5b200ac8c7c3b92590610835908590610df8565b60405180910390a3505050565b60008184841115610880576040517f08c379a00000000000000000000000000000000000000000000000000000000081526004016105b99190610e99565b505050900390565b73ffffffffffffffffffffffffffffffffffffffff82166108d5576040517f08c379a00000000000000000000000000000000000000000000000000000000081526004016105b99061108f565b61091f816040518060600160405280603381526020016111666033913973ffffffffffffffffffffffffffffffffffffffff86166000908152600460205260409020549190610842565b73ffffffffffffffffffffffffffffffffffffffff808516600090815260046020526040808220939093559084168152205461095b9082610b9e565b73ffffffffffffffffffffffffffffffffffffffff80841660008181526004602052604090819020939093559151908516907fddf252ad1be2c89b69c2b068fc378daa952ba7f163c4a11628f55a4df523b3ef90610835908590610df8565b73ffffffffffffffffffffffffffffffffffffffff808416600090815260036020908152604080832093861683529290522054610a0490849084906109ff9085610b9e565b610733565b505050565b610a0483836109ff846040518060600160405280603781526020016110fb6037913973ffffffffffffffffffffffffffffffffffffffff808a166000908152600360209081526040808320938c16835292905220549190610842565b6000610a6f61069c565b85604051602001610a81929190610db7565b604051602081830303815290604052805190602001209050600060018286868660405160008152602001604052604051610abe9493929190610e7b565b6020604051602081039080840390855afa158015610ae0573d6000803e3d6000fd5b50506040517fffffffffffffffffffffffffffffffffffffffffffffffffffffffffffffffe0015191505073ffffffffffffffffffffffffffffffffffffffff811615801590610b5b57508673ffffffffffffffffffffffffffffffffffffffff168173ffffffffffffffffffffffffffffffffffffffff16145b610b91576040517f08c379a00000000000000000000000000000000000000000000000000000000081526004016105b990610f9e565b50505050505050565b4690565b600082820183811015610bdd576040517f08c379a00000000000000000000000000000000000000000000000000000000081526004016105b990610f0a565b9392505050565b803573ffffffffffffffffffffffffffffffffffffffff811681146104b257600080fd5b600060208284031215610c19578081fd5b610bdd82610be4565b60008060408385031215610c34578081fd5b610c3d83610be4565b9150610c4b60208401610be4565b90509250929050565b600080600060608486031215610c68578081fd5b610c7184610be4565b9250610c7f60208501610be4565b9150604084013590509250925092565b600080600080600080600060e0888a031215610ca9578283fd5b610cb288610be4565b9650610cc060208901610be4565b95506040880135945060608801359350608088013560ff81168114610ce3578384fd5b9699959850939692959460a0840135945060c09093013592915050565b60008060408385031215610d12578182fd5b610d1b83610be4565b946020939093013593505050565b6000808354600180821660008114610d485760018114610d7d57610dac565b7fffffffffffffffffffffffffffffffffffffffffffffffffffffffffffffff0083168652607f600284041686019350610dac565b600283048786526020808720875b83811015610da45781548a820152908501908201610d8b565b505050860193505b509195945050505050565b7f190100000000000000000000000000000000000000000000000000000000000081526002810192909252602282015260420190565b901515815260200190565b90815260200190565b95865273ffffffffffffffffffffffffffffffffffffffff94851660208701529290931660408501526060840152608083019190915260a082015260c00190565b94855260208501939093526040840191909152606083015273ffffffffffffffffffffffffffffffffffffffff16608082015260a00190565b93845260ff9290921660208401526040830152606082015260800190565b6000602080835283518082850152825b81811015610ec557858101830151858201604001528201610ea9565b81811115610ed65783604083870101525b50601f017fffffffffffffffffffffffffffffffffffffffffffffffffffffffffffffffe016929092016040019392505050565b6020808252601b908201527f536166654d6174683a206164646974696f6e206f766572666c6f770000000000604082015260600190565b6020808252602c908201527f59616b3a3a5f617070726f76653a20617070726f76652066726f6d207468652060408201527f7a65726f20616464726573730000000000000000000000000000000000000000606082015260800190565b60208082526023908201527f59616b3a3a76616c69646174655369673a20696e76616c6964207369676e617460408201527f7572650000000000000000000000000000000000000000000000000000000000606082015260800190565b6020808252601e908201527f59616b3a3a7065726d69743a207369676e617475726520657870697265640000604082015260600190565b6020808252602a908201527f59616b3a3a5f617070726f76653a20617070726f766520746f20746865207a6560408201527f726f206164647265737300000000000000000000000000000000000000000000606082015260800190565b60208082526039908201527f59616b3a3a5f7472616e73666572546f6b656e733a2063616e6e6f742074726160408201527f6e7366657220746f20746865207a65726f206164647265737300000000000000606082015260800190565b60ff9190911681526020019056fe59616b3a3a5f6465637265617365416c6c6f77616e63653a2064656372656173656420616c6c6f77616e63652062656c6f77207a65726f59616b3a3a7472616e7366657246726f6d3a207472616e7366657220616d6f756e74206578636565647320616c6c6f77616e636559616b3a3a5f7472616e73666572546f6b656e733a207472616e7366657220657863656564732066726f6d2062616c616e6365a2646970667358221220649beba6913c45cb172354df3e7e548a55f2f580cdc58466d446c3846cd1671864736f6c63430007030033",
  "deployedBytecode": "0x608060405234801561001057600080fd5b506004361061011b5760003560e01c806370a08231116100b2578063a457c2d711610081578063d505accf11610066578063d505accf1461021a578063dd62ed3e1461022f578063ed24911d146102425761011b565b8063a457c2d7146101f4578063a9059cbb146102075761011b565b806370a08231146101be5780637ecebe00146101d157806395d89b41146101e45780639e4e7318146101ec5761011b565b806323b872dd116100ee57806323b872dd1461017b57806330adf81f1461018e578063313ce5671461019657806339509351146101ab5761011b565b806306fdde0314610120578063095ea7b31461013e57806318160ddd1461015e57806320606b7014610173575b600080fd5b61012861024a565b6040516101359190610e99565b60405180910390f35b61015161014c366004610d00565b6102f6565b6040516101359190610ded565b61016661030c565b6040516101359190610df8565b610166610312565b610151610189366004610c54565b610336565b610166610455565b61019e610479565b60405161013591906110ec565b6101516101b9366004610d00565b61047e565b6101666101cc366004610c08565b61048b565b6101666101df366004610c08565b6104b7565b6101286104c9565b610166610541565b610151610202366004610d00565b610565565b610151610215366004610d00565b610572565b61022d610228366004610c8f565b61057f565b005b61016661023d366004610c22565b610664565b61016661069c565b6000805460408051602060026001851615610100027fffffffffffffffffffffffffffffffffffffffffffffffffffffffffffffffff0190941693909304601f810184900484028201840190925281815292918301828280156102ee5780601f106102c3576101008083540402835291602001916102ee565b820191906000526020600020905b8154815290600101906020018083116102d157829003601f168201915b505050505081565b6000610303338484610733565b50600192915050565b60025481565b7f8b73c3c69bb8fe3d512ecc4cf759cc79239f7b179b0ffacaa9a75d522b39400f81565b73ffffffffffffffffffffffffffffffffffffffff831660008181526003602090815260408083203380855292528220549192909190821480159061039b57507fffffffffffffffffffffffffffffffffffffffffffffffffffffffffffffffff8114155b1561043e5760006103c78560405180606001604052806034815260200161113260349139849190610842565b73ffffffffffffffffffffffffffffffffffffffff808916600081815260036020908152604080832094891680845294909152908190208490555192935090917f8c5be1e5ebec7d5bd14f71427d1e84f3dd0314c0f7b2291e5b200ac8c7c3b92590610434908590610df8565b60405180910390a3505b610449868686610888565b50600195945050505050565b7f6e71edae12b1b97f4d1f60370fef10105fa2faae0126114a169c64845d6126c981565b601281565b60006103033384846109ba565b73ffffffffffffffffffffffffffffffffffffffff81166000908152600460205260409020545b919050565b60056020526000908152604090205481565b60018054604080516020600284861615610100027fffffffffffffffffffffffffffffffffffffffffffffffffffffffffffffffff0190941693909304601f810184900484028201840190925281815292918301828280156102ee5780601f106102c3576101008083540402835291602001916102ee565b7fc89efdaa54c0f20c7adf612882df0950f5a951637e0307cdcb4c672f298b8bc681565b6000610303338484610a09565b6000610303338484610888565b428410156105c2576040517f08c379a00000000000000000000000000000000000000000000000000000000081526004016105b990610ffb565b60405180910390fd5b73ffffffffffffffffffffffffffffffffffffffff87166000908152600560209081526040808320805460018101909155905161062a927f6e71edae12b1b97f4d1f60370fef10105fa2faae0126114a169c64845d6126c9928c928c928c92918c9101610e01565b60405160208183030381529060405280519060200120905061064f8882868686610a65565b61065a888888610733565b5050505050505050565b73ffffffffffffffffffffffffffffffffffffffff918216600090815260036020908152604080832093909416825291909152205490565b60007f8b73c3c69bb8fe3d512ecc4cf759cc79239f7b179b0ffacaa9a75d522b39400f60001b60006040516106d19190610d29565b6040519081900390207fc89efdaa54c0f20c7adf612882df0950f5a951637e0307cdcb4c672f298b8bc6610703610b9a565b30604051602001610718959493929190610e42565b60405160208183030381529060405280519060200120905090565b73ffffffffffffffffffffffffffffffffffffffff8316610780576040517f08c379a00000000000000000000000000000000000000000000000000000000081526004016105b990610f41565b73ffffffffffffffffffffffffffffffffffffffff82166107cd576040517f08c379a00000000000000000000000000000000000000000000000000000000081526004016105b990611032565b73ffffffffffffffffffffffffffffffffffffffff80841660008181526003602090815260408083209487168084529490915290819020849055517f8c5be1e5ebec7d5bd14f71427d1e84f3dd0314c0f7b2291e5b200ac8c7c3b92590610835908590610df8565b60405180910390a3505050565b60008184841115610880576040517f08c379a00000000000000000000000000000000000000000000000000000000081526004016105b99190610e99565b505050900390565b73ffffffffffffffffffffffffffffffffffffffff82166108d5576040517f08c379a00000000000000000000000000000000000000000000000000000000081526004016105b99061108f565b61091f816040518060600160405280603381526020016111666033913973ffffffffffffffffffffffffffffffffffffffff86166000908152600460205260409020549190610842565b73ffffffffffffffffffffffffffffffffffffffff808516600090815260046020526040808220939093559084168152205461095b9082610b9e565b73ffffffffffffffffffffffffffffffffffffffff80841660008181526004602052604090819020939093559151908516907fddf252ad1be2c89b69c2b068fc378daa952ba7f163c4a11628f55a4df523b3ef90610835908590610df8565b73ffffffffffffffffffffffffffffffffffffffff808416600090815260036020908152604080832093861683529290522054610a0490849084906109ff9085610b9e565b610733565b505050565b610a0483836109ff846040518060600160405280603781526020016110fb6037913973ffffffffffffffffffffffffffffffffffffffff808a166000908152600360209081526040808320938c16835292905220549190610842565b6000610a6f61069c565b85604051602001610a81929190610db7565b604051602081830303815290604052805190602001209050600060018286868660405160008152602001604052604051610abe9493929190610e7b565b6020604051602081039080840390855afa158015610ae0573d6000803e3d6000fd5b50506040517fffffffffffffffffffffffffffffffffffffffffffffffffffffffffffffffe0015191505073ffffffffffffffffffffffffffffffffffffffff811615801590610b5b57508673ffffffffffffffffffffffffffffffffffffffff168173ffffffffffffffffffffffffffffffffffffffff16145b610b91576040517f08c379a00000000000000000000000000000000000000000000000000000000081526004016105b990610f9e565b50505050505050565b4690565b600082820183811015610bdd576040517f08c379a00000000000000000000000000000000000000000000000000000000081526004016105b990610f0a565b9392505050565b803573ffffffffffffffffffffffffffffffffffffffff811681146104b257600080fd5b600060208284031215610c19578081fd5b610bdd82610be4565b60008060408385031215610c34578081fd5b610c3d83610be4565b9150610c4b60208401610be4565b90509250929050565b600080600060608486031215610c68578081fd5b610c7184610be4565b9250610c7f60208501610be4565b9150604084013590509250925092565b600080600080600080600060e0888a031215610ca9578283fd5b610cb288610be4565b9650610cc060208901610be4565b95506040880135945060608801359350608088013560ff81168114610ce3578384fd5b9699959850939692959460a0840135945060c09093013592915050565b60008060408385031215610d12578182fd5b610d1b83610be4565b946020939093013593505050565b6000808354600180821660008114610d485760018114610d7d57610dac565b7fffffffffffffffffffffffffffffffffffffffffffffffffffffffffffffff0083168652607f600284041686019350610dac565b600283048786526020808720875b83811015610da45781548a820152908501908201610d8b565b505050860193505b509195945050505050565b7f190100000000000000000000000000000000000000000000000000000000000081526002810192909252602282015260420190565b901515815260200190565b90815260200190565b95865273ffffffffffffffffffffffffffffffffffffffff94851660208701529290931660408501526060840152608083019190915260a082015260c00190565b94855260208501939093526040840191909152606083015273ffffffffffffffffffffffffffffffffffffffff16608082015260a00190565b93845260ff9290921660208401526040830152606082015260800190565b6000602080835283518082850152825b81811015610ec557858101830151858201604001528201610ea9565b81811115610ed65783604083870101525b50601f017fffffffffffffffffffffffffffffffffffffffffffffffffffffffffffffffe016929092016040019392505050565b6020808252601b908201527f536166654d6174683a206164646974696f6e206f766572666c6f770000000000604082015260600190565b6020808252602c908201527f59616b3a3a5f617070726f76653a20617070726f76652066726f6d207468652060408201527f7a65726f20616464726573730000000000000000000000000000000000000000606082015260800190565b60208082526023908201527f59616b3a3a76616c69646174655369673a20696e76616c6964207369676e617460408201527f7572650000000000000000000000000000000000000000000000000000000000606082015260800190565b6020808252601e908201527f59616b3a3a7065726d69743a207369676e617475726520657870697265640000604082015260600190565b6020808252602a908201527f59616b3a3a5f617070726f76653a20617070726f766520746f20746865207a6560408201527f726f206164647265737300000000000000000000000000000000000000000000606082015260800190565b60208082526039908201527f59616b3a3a5f7472616e73666572546f6b656e733a2063616e6e6f742074726160408201527f6e7366657220746f20746865207a65726f206164647265737300000000000000606082015260800190565b60ff9190911681526020019056fe59616b3a3a5f6465637265617365416c6c6f77616e63653a2064656372656173656420616c6c6f77616e63652062656c6f77207a65726f59616b3a3a7472616e7366657246726f6d3a207472616e7366657220616d6f756e74206578636565647320616c6c6f77616e636559616b3a3a5f7472616e73666572546f6b656e733a207472616e7366657220657863656564732066726f6d2062616c616e6365a2646970667358221220649beba6913c45cb172354df3e7e548a55f2f580cdc58466d446c3846cd1671864736f6c63430007030033",
  "devdoc": {
    "details": "The governance token for Yield Yak ERC-20 with fixed supply + offchain signing",
    "kind": "dev",
    "methods": {
      "allowance(address,address)": {
        "params": {
          "account": "The address of the account holding the funds",
          "spender": "The address of the account spending the funds"
        },
        "returns": {
          "_0": "The number of tokens approved"
        }
      },
      "approve(address,uint256)": {
        "details": "This will overwrite the approval amount for `spender` and is subject to issues noted [here](https://eips.ethereum.org/EIPS/eip-20#approve) It is recommended to use increaseAllowance and decreaseAllowance instead",
        "params": {
          "amount": "The number of tokens that are approved (2^256-1 means infinite)",
          "spender": "The address of the account which may transfer tokens"
        },
        "returns": {
          "_0": "Whether or not the approval succeeded"
        }
      },
      "balanceOf(address)": {
        "params": {
          "account": "The address of the account to get the balance of"
        },
        "returns": {
          "_0": "The number of tokens held"
        }
      },
      "decreaseAllowance(address,uint256)": {
        "params": {
          "spender": "Spender's address",
          "subtractedValue": "Amount of decrease in allowance"
        },
        "returns": {
          "_0": "True if successful"
        }
      },
      "getDomainSeparator()": {
        "returns": {
          "_0": "Separator"
        }
      },
      "increaseAllowance(address,uint256)": {
        "params": {
          "addedValue": "Amount of increase in allowance",
          "spender": "Spender's address"
        },
        "returns": {
          "_0": "True if successful"
        }
      },
      "permit(address,address,uint256,uint256,uint8,bytes32,bytes32)": {
        "params": {
          "deadline": "The time at which to expire the signature",
          "owner": "The address to approve from",
          "r": "Half of the ECDSA signature pair",
          "s": "Half of the ECDSA signature pair",
          "spender": "The address to be approved",
          "v": "The recovery byte of the signature",
          "value": "The number of tokens that are approved (2^256-1 means infinite)"
        }
      },
      "transfer(address,uint256)": {
        "params": {
          "amount": "The number of tokens to transfer",
          "dst": "The address of the destination account"
        },
        "returns": {
          "_0": "Whether or not the transfer succeeded"
        }
      },
      "transferFrom(address,address,uint256)": {
        "params": {
          "amount": "The number of tokens to transfer",
          "dst": "The address of the destination account",
          "src": "The address of the source account"
        },
        "returns": {
          "_0": "Whether or not the transfer succeeded"
        }
      }
    },
    "stateVariables": {
      "allowances": {
        "details": "Allowance amounts on behalf of others"
      },
      "balances": {
        "details": "Official record of token balances for each account"
      }
    },
    "title": "YakToken",
    "version": 1
  },
  "userdoc": {
    "events": {
      "Approval(address,address,uint256)": {
        "notice": "The standard EIP-20 approval event"
      },
      "Transfer(address,address,uint256)": {
        "notice": "The standard EIP-20 transfer event"
      }
    },
    "kind": "user",
    "methods": {
      "DOMAIN_TYPEHASH()": {
        "notice": "The EIP-712 typehash for the contract's domain, keccak256(\"EIP712Domain(string name,string version,uint256 chainId,address verifyingContract)\")"
      },
      "PERMIT_TYPEHASH()": {
        "notice": "The EIP-712 typehash for permit (EIP-2612), keccak256(\"Permit(address owner,address spender,uint256 value,uint256 nonce,uint256 deadline)\");"
      },
      "VERSION_HASH()": {
        "notice": "The EIP-712 version hash, keccak256(\"1\");"
      },
      "allowance(address,address)": {
        "notice": "Get the number of tokens `spender` is approved to spend on behalf of `account`"
      },
      "approve(address,uint256)": {
        "notice": "Approve `spender` to transfer up to `amount` from `src`"
      },
      "balanceOf(address)": {
        "notice": "Get the number of tokens held by the `account`"
      },
      "constructor": {
        "notice": "Create and send entire token supply to _recipient"
      },
      "decimals()": {
        "notice": "EIP-20 token decimals for this token"
      },
      "decreaseAllowance(address,uint256)": {
        "notice": "Decrease the allowance by a given amount"
      },
      "getDomainSeparator()": {
        "notice": "EIP-712 Domain separator"
      },
      "increaseAllowance(address,uint256)": {
        "notice": "Increase the allowance by a given amount"
      },
      "name()": {
        "notice": "EIP-20 token name for this token"
      },
      "nonces(address)": {
        "notice": "A record of states for signing / validating signatures"
      },
      "permit(address,address,uint256,uint256,uint8,bytes32,bytes32)": {
        "notice": "Triggers an approval from owner to spender"
      },
      "symbol()": {
        "notice": "EIP-20 token symbol for this token"
      },
      "totalSupply()": {
        "notice": "Total number of tokens in circulation"
      },
      "transfer(address,uint256)": {
        "notice": "Transfer `amount` tokens from `msg.sender` to `dst`"
      },
      "transferFrom(address,address,uint256)": {
        "notice": "Transfer `amount` tokens from `src` to `dst`"
      }
    },
    "version": 1
  },
  "storageLayout": {
    "storage": [
      {
        "astId": 3998,
        "contract": "contracts/YakToken.sol:YakToken",
        "label": "name",
        "offset": 0,
        "slot": "0",
        "type": "t_string_storage"
      },
      {
        "astId": 4002,
        "contract": "contracts/YakToken.sol:YakToken",
        "label": "symbol",
        "offset": 0,
        "slot": "1",
        "type": "t_string_storage"
      },
      {
        "astId": 4010,
        "contract": "contracts/YakToken.sol:YakToken",
        "label": "totalSupply",
        "offset": 0,
        "slot": "2",
        "type": "t_uint256"
      },
      {
        "astId": 4017,
        "contract": "contracts/YakToken.sol:YakToken",
        "label": "allowances",
        "offset": 0,
        "slot": "3",
        "type": "t_mapping(t_address,t_mapping(t_address,t_uint256))"
      },
      {
        "astId": 4022,
        "contract": "contracts/YakToken.sol:YakToken",
        "label": "balances",
        "offset": 0,
        "slot": "4",
        "type": "t_mapping(t_address,t_uint256)"
      },
      {
        "astId": 4039,
        "contract": "contracts/YakToken.sol:YakToken",
        "label": "nonces",
        "offset": 0,
        "slot": "5",
        "type": "t_mapping(t_address,t_uint256)"
      }
    ],
    "types": {
      "t_address": {
        "encoding": "inplace",
        "label": "address",
        "numberOfBytes": "20"
      },
      "t_mapping(t_address,t_mapping(t_address,t_uint256))": {
        "encoding": "mapping",
        "key": "t_address",
        "label": "mapping(address => mapping(address => uint256))",
        "numberOfBytes": "32",
        "value": "t_mapping(t_address,t_uint256)"
      },
      "t_mapping(t_address,t_uint256)": {
        "encoding": "mapping",
        "key": "t_address",
        "label": "mapping(address => uint256)",
        "numberOfBytes": "32",
        "value": "t_uint256"
      },
      "t_string_storage": {
        "encoding": "bytes",
        "label": "string",
        "numberOfBytes": "32"
      },
      "t_uint256": {
        "encoding": "inplace",
        "label": "uint256",
        "numberOfBytes": "32"
      }
    }
  }
}